{
  "schemaVersion": 2,
  "contentRevision": "ws-content-r2",
  "domain": "items",
  "records": [
    {
      "id": "WSI-CONS-RATION_PACK",
      "sourceDocumentId": "ITEM-LIST-001",
      "enabled": true,
      "codexIndex": 100,
      "textKey": "item.wildsurvival.wsi_cons_ration_pack",
      "customModelKey": "wildsurvival:item/wsi_cons_ration_pack",
      "name": "야전 배급팩",
      "firstDay": 1,
      "displayMaterial": "BREAD",
      "category": "CONS",
      "stackLimit": 16,
      "ownership": "PERSONAL",
      "usePolicy": "QUICK_BINDABLE",
      "connectedFacilityId": "",
      "effectText": "8초 섭취, 허기·포화 회복, 전투 중 사용시간 +50%",
      "constraintText": "",
      "recipeId": "WSRCP-S09",
      "raw": [
        "0100",
        "WSI-CONS-RATION_PACK",
        "야전 배급팩",
        "1",
        "BREAD",
        "16",
        "8초 섭취, 허기·포화 회복, 전투 중 사용시간 +50%",
        "WSRCP-S09"
      ]
    },
    {
      "id": "WSI-CONS-BANDAGE",
      "sourceDocumentId": "ITEM-LIST-001",
      "enabled": true,
      "codexIndex": 101,
      "textKey": "item.wildsurvival.wsi_cons_bandage",
      "customModelKey": "wildsurvival:item/wsi_cons_bandage",
      "name": "붕대",
      "firstDay": 1,
      "displayMaterial": "PAPER",
      "category": "CONS",
      "stackLimit": 16,
      "ownership": "PERSONAL",
      "usePolicy": "QUICK_BINDABLE",
      "connectedFacilityId": "",
      "effectText": "BLEED 1중첩 제거, 직접 치료 없음",
      "constraintText": "",
      "recipeId": "WSRCP-S01",
      "raw": [
        "0101",
        "WSI-CONS-BANDAGE",
        "붕대",
        "1",
        "PAPER",
        "16",
        "BLEED 1중첩 제거, 직접 치료 없음",
        "WSRCP-S01"
      ]
    },
    {
      "id": "WSI-CONS-REPAIR_KIT",
      "sourceDocumentId": "ITEM-LIST-001",
      "enabled": true,
      "codexIndex": 102,
      "textKey": "item.wildsurvival.wsi_cons_repair_kit",
      "customModelKey": "wildsurvival:item/wsi_cons_repair_kit",
      "name": "야전 수리 키트",
      "firstDay": 2,
      "displayMaterial": "ANVIL",
      "category": "CONS",
      "stackLimit": 8,
      "ownership": "PERSONAL",
      "usePolicy": "QUICK_BINDABLE",
      "connectedFacilityId": "",
      "effectText": "일반 수리, BROKEN 장비 최대 내구 40%까지 복구",
      "constraintText": "",
      "recipeId": "WSRCP-S02",
      "raw": [
        "0102",
        "WSI-CONS-REPAIR_KIT",
        "야전 수리 키트",
        "2",
        "ANVIL",
        "8",
        "일반 수리, BROKEN 장비 최대 내구 40%까지 복구",
        "WSRCP-S02"
      ]
    },
    {
      "id": "WSI-AMMO-ARROW_BUNDLE",
      "sourceDocumentId": "ITEM-LIST-001",
      "enabled": true,
      "codexIndex": 103,
      "textKey": "item.wildsurvival.wsi_ammo_arrow_bundle",
      "customModelKey": "wildsurvival:item/wsi_ammo_arrow_bundle",
      "name": "일반 화살 묶음",
      "firstDay": 3,
      "displayMaterial": "ARROW",
      "category": "AMMO",
      "stackLimit": 64,
      "ownership": "PERSONAL",
      "usePolicy": "AMMO_LEDGER_DEPOSIT",
      "connectedFacilityId": "",
      "effectText": "활·석궁 공용 16발 단위 탄약 원장 충전",
      "constraintText": "",
      "recipeId": "WSRCP-S03",
      "raw": [
        "0103",
        "WSI-AMMO-ARROW_BUNDLE",
        "일반 화살 묶음",
        "3",
        "ARROW",
        "64",
        "활·석궁 공용 16발 단위 탄약 원장 충전",
        "WSRCP-S03"
      ]
    },
    {
      "id": "WSI-AMMO-PIERCING_BOLT_BUNDLE",
      "sourceDocumentId": "ITEM-LIST-001",
      "enabled": true,
      "codexIndex": 104,
      "textKey": "item.wildsurvival.wsi_ammo_piercing_bolt_bundle",
      "customModelKey": "wildsurvival:item/wsi_ammo_piercing_bolt_bundle",
      "name": "관통 볼트 묶음",
      "firstDay": 5,
      "displayMaterial": "SPECTRAL_ARROW",
      "category": "AMMO",
      "stackLimit": 32,
      "ownership": "PERSONAL",
      "usePolicy": "AMMO_LEDGER_DEPOSIT",
      "connectedFacilityId": "",
      "effectText": "석궁 전용 8발, 첫 유효 적중 1체 PEN +12",
      "constraintText": "",
      "recipeId": "WSRCP-S04",
      "raw": [
        "0104",
        "WSI-AMMO-PIERCING_BOLT_BUNDLE",
        "관통 볼트 묶음",
        "5",
        "SPECTRAL_ARROW",
        "32",
        "석궁 전용 8발, 첫 유효 적중 1체 PEN +12",
        "WSRCP-S04"
      ]
    },
    {
      "id": "WSI-CONS-PURIFY_AMPOULE",
      "sourceDocumentId": "ITEM-LIST-001",
      "enabled": true,
      "codexIndex": 105,
      "textKey": "item.wildsurvival.wsi_cons_purify_ampoule",
      "customModelKey": "wildsurvival:item/wsi_cons_purify_ampoule",
      "name": "정화 앰풀",
      "firstDay": 5,
      "displayMaterial": "HONEY_BOTTLE",
      "category": "CONS",
      "stackLimit": 8,
      "ownership": "PERSONAL",
      "usePolicy": "QUICK_BINDABLE",
      "connectedFacilityId": "",
      "effectText": "개인 오염 -15, 상태 제거 없음, 전투당 2회",
      "constraintText": "",
      "recipeId": "WSRCP-S05",
      "raw": [
        "0105",
        "WSI-CONS-PURIFY_AMPOULE",
        "정화 앰풀",
        "5",
        "HONEY_BOTTLE",
        "8",
        "개인 오염 -15, 상태 제거 없음, 전투당 2회",
        "WSRCP-S05"
      ]
    },
    {
      "id": "WSI-CONS-AP_STIM",
      "sourceDocumentId": "ITEM-LIST-001",
      "enabled": true,
      "codexIndex": 106,
      "textKey": "item.wildsurvival.wsi_cons_ap_stim",
      "customModelKey": "wildsurvival:item/wsi_cons_ap_stim",
      "name": "응급 AP 자극제",
      "firstDay": 6,
      "displayMaterial": "SUGAR",
      "category": "CONS",
      "stackLimit": 8,
      "ownership": "PERSONAL",
      "usePolicy": "QUICK_BINDABLE",
      "connectedFacilityId": "",
      "effectText": "AP +30 즉시 회복, 초과분 소멸·탈진 해제 아님, 전투당 1회",
      "constraintText": "",
      "recipeId": "WSRCP-S06",
      "raw": [
        "0106",
        "WSI-CONS-AP_STIM",
        "응급 AP 자극제",
        "6",
        "SUGAR",
        "8",
        "AP +30 즉시 회복, 초과분 소멸·탈진 해제 아님, 전투당 1회",
        "WSRCP-S06"
      ]
    },
    {
      "id": "WSI-CONS-RESCUE_BRACE",
      "sourceDocumentId": "ITEM-LIST-001",
      "enabled": true,
      "codexIndex": 107,
      "textKey": "item.wildsurvival.wsi_cons_rescue_brace",
      "customModelKey": "wildsurvival:item/wsi_cons_rescue_brace",
      "name": "구조 고정대",
      "firstDay": 3,
      "displayMaterial": "TRIPWIRE_HOOK",
      "category": "CONS",
      "stackLimit": 8,
      "ownership": "PERSONAL",
      "usePolicy": "QUICK_BINDABLE",
      "connectedFacilityId": "",
      "effectText": "다음 구조 1회 중단 피해 임계 +15%, 강화형과 비합산",
      "constraintText": "",
      "recipeId": "WSRCP-S07",
      "raw": [
        "0107",
        "WSI-CONS-RESCUE_BRACE",
        "구조 고정대",
        "3",
        "TRIPWIRE_HOOK",
        "8",
        "다음 구조 1회 중단 피해 임계 +15%, 강화형과 비합산",
        "WSRCP-S07"
      ]
    },
    {
      "id": "WSI-CONS-PORTABLE_PURIFIER_CHARGE",
      "sourceDocumentId": "ITEM-LIST-001",
      "enabled": true,
      "codexIndex": 108,
      "textKey": "item.wildsurvival.wsi_cons_portable_purifier_charge",
      "customModelKey": "wildsurvival:item/wsi_cons_portable_purifier_charge",
      "name": "휴대 정화기 충전",
      "firstDay": 5,
      "displayMaterial": "GLOWSTONE_DUST",
      "category": "CONS",
      "stackLimit": 16,
      "ownership": "PERSONAL",
      "usePolicy": "QUICK_BINDABLE",
      "connectedFacilityId": "",
      "effectText": "FAC-P05 60초 가동",
      "constraintText": "",
      "recipeId": "WSRCP-S08",
      "raw": [
        "0108",
        "WSI-CONS-PORTABLE_PURIFIER_CHARGE",
        "휴대 정화기 충전",
        "5",
        "GLOWSTONE_DUST",
        "16",
        "FAC-P05 60초 가동",
        "WSRCP-S08"
      ]
    },
    {
      "id": "WSI-CONS-ANTIDOTE_INJECTION",
      "sourceDocumentId": "ITEM-LIST-001",
      "enabled": true,
      "codexIndex": 109,
      "textKey": "item.wildsurvival.wsi_cons_antidote_injection",
      "customModelKey": "wildsurvival:item/wsi_cons_antidote_injection",
      "name": "해독 주사",
      "firstDay": 11,
      "displayMaterial": "POTION",
      "category": "CONS",
      "stackLimit": 8,
      "ownership": "PERSONAL",
      "usePolicy": "QUICK_BINDABLE",
      "connectedFacilityId": "",
      "effectText": "POISON 2중첩 또는 약한 독 1개 제거",
      "constraintText": "",
      "recipeId": "WSRCP-D20-S01",
      "raw": [
        "0109",
        "WSI-CONS-ANTIDOTE_INJECTION",
        "해독 주사",
        "11",
        "POTION",
        "8",
        "POISON 2중첩 또는 약한 독 1개 제거",
        "WSRCP-D20-S01"
      ]
    },
    {
      "id": "WSI-CONS-COOLING_SALVE",
      "sourceDocumentId": "ITEM-LIST-001",
      "enabled": true,
      "codexIndex": 110,
      "textKey": "item.wildsurvival.wsi_cons_cooling_salve",
      "customModelKey": "wildsurvival:item/wsi_cons_cooling_salve",
      "name": "냉각 연고",
      "firstDay": 12,
      "displayMaterial": "SNOWBALL",
      "category": "CONS",
      "stackLimit": 8,
      "ownership": "PERSONAL",
      "usePolicy": "QUICK_BINDABLE",
      "connectedFacilityId": "",
      "effectText": "BURN 2중첩 제거, 5초 화상 지속시간 -25%",
      "constraintText": "",
      "recipeId": "WSRCP-D20-S02",
      "raw": [
        "0110",
        "WSI-CONS-COOLING_SALVE",
        "냉각 연고",
        "12",
        "SNOWBALL",
        "8",
        "BURN 2중첩 제거, 5초 화상 지속시간 -25%",
        "WSRCP-D20-S02"
      ]
    },
    {
      "id": "WSI-CONS-TOURNIQUET",
      "sourceDocumentId": "ITEM-LIST-001",
      "enabled": true,
      "codexIndex": 111,
      "textKey": "item.wildsurvival.wsi_cons_tourniquet",
      "customModelKey": "wildsurvival:item/wsi_cons_tourniquet",
      "name": "지혈 압박대",
      "firstDay": 13,
      "displayMaterial": "RED_CARPET",
      "category": "CONS",
      "stackLimit": 8,
      "ownership": "PERSONAL",
      "usePolicy": "QUICK_BINDABLE",
      "connectedFacilityId": "",
      "effectText": "BLEED 2중첩 제거, 직접 치료 없음",
      "constraintText": "",
      "recipeId": "WSRCP-D20-S03",
      "raw": [
        "0111",
        "WSI-CONS-TOURNIQUET",
        "지혈 압박대",
        "13",
        "RED_CARPET",
        "8",
        "BLEED 2중첩 제거, 직접 치료 없음",
        "WSRCP-D20-S03"
      ]
    },
    {
      "id": "WSI-CONS-NEURAL_STABILIZER",
      "sourceDocumentId": "ITEM-LIST-001",
      "enabled": true,